scenarioNo,ImageAll,TextLeft,TextRight,TypeLeft,TypeRight,Lefttype,Righttype,trials_Practice.thisRepN,trials_Practice.thisTrialN,trials_Practice.thisN,trials_Practice.thisIndex,trials_Pre.thisRepN,trials_Pre.thisTrialN,trials_Pre.thisN,trials_Pre.thisIndex,rating_p.response,rating_p.rt,textRight_p.started,textRight_p.stopped,rating.response,rating.rt,textLeft.started,textLeft.stopped,ThankYou.started,ThankYou.stopped,participant,session,date,expName,psychopyVersion,frameRate,
scenario2,scenario_0_EXAMPLE.png,iCub categorizza gli oggetti in base alla loro forma.,iCub preferisce gli oggetti sferici.,M,I,,,0,0,0,0,,,,,94,37.934,139.84823519999918,None,,,,,,,30,001,2021_Nov_23_1647,InStance_GRUPPO_Psychopy,2020.1.3,59.597490470576645,
scenario30,scenario_30.jpg,iCub non riesce a scegliere con quale giocattolo giocare.,iCub è in modalità stand-by.,,,I,M,,,,,0,0,0,15,,,,,82,15.075,180.86663839999528,None,,,30,001,2021_Nov_23_1647,InStance_GRUPPO_Psychopy,2020.1.3,59.597490470576645,
scenario20,scenario_20.jpg,iCub muove la testa verso I maglioni dai colori luminosi.,iCub è sorpreso che ci sia una persona nuova.,,,M,I,,,,,0,1,1,26,,,,,80,35.35,195.9884951999993,None,,,30,001,2021_Nov_23_1647,InStance_GRUPPO_Psychopy,2020.1.3,59.597490470576645,
scenario11,scenario_11.jpg,iCub calcola il peso delle palle.,iCub vuole giocare con la ragazza.,,,M,I,,,,,0,2,2,5,,,,,30,40.664,231.3883274999971,None,,,30,001,2021_Nov_23_1647,InStance_GRUPPO_Psychopy,2020.1.3,59.597490470576645,
scenario26,scenario_26.jpg,iCub è deluso che la palla non rimbalzi.,iCub ha un malfunzionamento alla mano.,,,I,M,,,,,0,3,3,12,,,,,24,21.777,272.1070403999911,None,,,30,001,2021_Nov_23_1647,InStance_GRUPPO_Psychopy,2020.1.3,59.597490470576645,
scenario31,scenario_31.jpg,iCub mette gli oggetti nel contenitore con la forma corrispondente.,iCub sa che è giusto mettere in ordine il tavolo dopo aver giocato.,,,M,I,,,,,0,4,4,31,,,,,1,25.243,293.939847799993,None,,,30,001,2021_Nov_23_1647,InStance_GRUPPO_Psychopy,2020.1.3,59.597490470576645,
scenario19,scenario_19.jpg,iCub non ha intenzione di raccogliere la lattina caduta.,iCub non può bloccare la procedura nonostante la lattina stia cadendo.,,,I,M,,,,,0,5,5,25,,,,,75,22.508,319.2350843000022,None,,,30,001,2021_Nov_23_1647,InStance_GRUPPO_Psychopy,2020.1.3,59.597490470576645,
scenario28,scenario_28.jpg,iCub vorrebbe tenere questo cubo.,iCub classifica i cubi in base al colore.,,,I,M,,,,,0,6,6,30,,,,,87,17.438,341.7937721999915,None,,,30,001,2021_Nov_23_1647,InStance_GRUPPO_Psychopy,2020.1.3,59.597490470576645,
scenario3,scenario_3.jpg,iCub afferra meglio gli oggetti cilindrici.,iCub pensa che alla ragazza piaccia il bicchiere.,,,M,I,,,,,0,7,7,1,,,,,29,19.405,359.28100930000073,None,,,30,001,2021_Nov_23_1647,InStance_GRUPPO_Psychopy,2020.1.3,59.597490470576645,
scenario2,scenario_2.jpg,iCub è sorpreso di vedere l'oggetto in aria.,iCub guarda gli oggetti all'altezza degli occhi.,,,I,M,,,,,0,8,8,17,,,,,21,13.116,378.73749329999555,None,,,30,001,2021_Nov_23_1647,InStance_GRUPPO_Psychopy,2020.1.3,59.597490470576645,
scenario6,scenario_6.jpg,iCub traccia il cursore del mouse.,iCub è interessato a quello che c'è sullo schermo.,,,M,I,,,,,0,9,9,19,,,,,72,20.174,391.9015067,None,,,30,001,2021_Nov_23_1647,InStance_GRUPPO_Psychopy,2020.1.3,59.597490470576645,
scenario27,scenario_27.jpg,iCub si diverte a giocare con il camioncino.,iCub allena la coordinazione testa-mano.,,,I,M,,,,,0,10,10,13,,,,,63,18.353,412.12691229999473,None,,,30,001,2021_Nov_23_1647,InStance_GRUPPO_Psychopy,2020.1.3,59.597490470576645,
scenario12,scenario_12.jpg,iCub allinea la testa con la webcam.,iCub è sorpreso dalla webcam che si muove.,,,M,I,,,,,0,11,11,6,,,,,10,38.072,430.5303770000028,None,,,30,001,2021_Nov_23_1647,InStance_GRUPPO_Psychopy,2020.1.3,59.597490470576645,
scenario4,scenario_4.jpg,iCub calcola il numero di monete.,iCub ha deciso di restituire le monete.,,,M,I,,,,,0,12,12,18,,,,,32,43.289,468.65649379999377,None,,,30,001,2021_Nov_23_1647,InStance_GRUPPO_Psychopy,2020.1.3,59.597490470576645,
scenario7,scenario_7.jpg,iCub traccia la posizione della palla.,iCub non vede l'ora di ricevere la palla.,,,M,I,,,,,0,13,13,3,,,,,35,24.704,511.9963607999962,None,,,30,001,2021_Nov_23_1647,InStance_GRUPPO_Psychopy,2020.1.3,59.597490470576645,
scenario5,scenario_5.jpg,iCub è annoiato.,iCub è in fase di spegnimento.,,,I,M,,,,,0,14,14,2,,,,,83,17.006,536.7483869999996,None,,,30,001,2021_Nov_23_1647,InStance_GRUPPO_Psychopy,2020.1.3,59.597490470576645,
scenario33,scenario_33.jpg,iCub è affascinato dall'uso degli utensili.,iCub afferra l'oggetto più vicino.,,,I,M,,,,,0,15,15,32,,,,,74,17.335,553.8054391999904,None,,,30,001,2021_Nov_23_1647,InStance_GRUPPO_Psychopy,2020.1.3,59.597490470576645,
scenario32,scenario_32.jpg,iCub si diverte contando le dita su ciascuna mano.,iCub calibra la posizione della testa con quella della mano.,,,I,M,,,,,0,16,16,16,,,,,72,30.278,571.1916441999929,None,,,30,001,2021_Nov_23_1647,InStance_GRUPPO_Psychopy,2020.1.3,59.597490470576645,
scenario24,scenario_24.jpg,iCub traccia i movimenti della mano.,iCub ha capito che la ragazza vuole la palla.,,,M,I,,,,,0,17,17,11,,,,,17,26.906,601.5188933000027,None,,,30,001,2021_Nov_23_1647,InStance_GRUPPO_Psychopy,2020.1.3,59.597490470576645,
scenario23,scenario_23.jpg,iCub sta esprimendo un'opinione.,iCub sta ripetendo il gesto di indicare.,,,I,M,,,,,0,18,18,28,,,,,67,34.117,628.4764988999959,None,,,30,001,2021_Nov_23_1647,InStance_GRUPPO_Psychopy,2020.1.3,59.597490470576645,
scenario17,scenario_17.jpg,iCub cerca di essere affascinante.,iCub ha i motori delle palpebre rotti.,,,I,M,,,,,0,19,19,24,,,,,78,12.052,662.643062099989,None,,,30,001,2021_Nov_23_1647,InStance_GRUPPO_Psychopy,2020.1.3,59.597490470576645,
scenario22,scenario_22.jpg,iCub riporta la testa nella posizione iniziale.,iCub non è più interessato al giocattolo.,,,M,I,,,,,0,20,20,27,,,,,12,24.14,674.7437890000001,None,,,30,001,2021_Nov_23_1647,InStance_GRUPPO_Psychopy,2020.1.3,59.597490470576645,
scenario29,scenario_29.jpg,iCub è bloccato.,iCub immagina che il giocattolo sia ancora lì.,,,M,I,,,,,0,21,21,14,,,,,19,19.903,698.9340002999961,None,,,30,001,2021_Nov_23_1647,InStance_GRUPPO_Psychopy,2020.1.3,59.597490470576645,
scenario8,scenario_8.jpg,iCub finge di essere un giardiniere.,iCub regola la forza in base al peso dell'oggetto.,,,I,M,,,,,0,22,22,4,,,,,78,10.05,718.8890799999936,None,,,30,001,2021_Nov_23_1647,InStance_GRUPPO_Psychopy,2020.1.3,59.597490470576645,
scenario14,scenario_14.jpg,iCub registra le città italiane in ordine alfabetico.,iCub preferisce le città italiane.,,,M,I,,,,,0,23,23,23,,,,,26,18.938,728.9883739999932,None,,,30,001,2021_Nov_23_1647,InStance_GRUPPO_Psychopy,2020.1.3,59.597490470576645,
scenario25,scenario_25.jpg,iCub bara guardando le carte dell'avversario.,iCub ha perso l'equilibrio per un momento.,,,I,M,,,,,0,24,24,29,,,,,23,64.409,747.9804351999919,None,,,30,001,2021_Nov_23_1647,InStance_GRUPPO_Psychopy,2020.1.3,59.597490470576645,
scenario21,scenario_21.jpg,iCub pensa che le ragazze abbiano bisogno di cibo sano.,iCub può afferrare le arance più facilmente della torta.,,,I,M,,,,,0,25,25,10,,,,,62,11.033,812.441829000003,None,,,30,001,2021_Nov_23_1647,InStance_GRUPPO_Psychopy,2020.1.3,59.597490470576645,
scenario16,scenario_16.jpg,iCub ha deciso di cucinare una torta.,iCub segue le istruzioni della ricetta.,,,I,M,,,,,0,26,26,8,,,,,25,19.952,823.5268301999895,None,,,30,001,2021_Nov_23_1647,InStance_GRUPPO_Psychopy,2020.1.3,59.597490470576645,
scenario9,scenario_9.jpg,iCub è disperato perchè non trova il suo giocattolo preferito.,iCub ha i motori rotti.,,,I,M,,,,,0,27,27,20,,,,,80,10.52,843.528522099994,None,,,30,001,2021_Nov_23_1647,InStance_GRUPPO_Psychopy,2020.1.3,59.597490470576645,
scenario18,scenario_18.jpg,iCub misura la distanza fra la ragazza e le cuffie.,iCub si aspetta che la ragazza dia in prestito le cuffie.,,,M,I,,,,,0,28,28,9,,,,,14,17.053,854.0982264999911,None,,,30,001,2021_Nov_23_1647,InStance_GRUPPO_Psychopy,2020.1.3,59.597490470576645,
scenario10,scenario_10.jpg,iCub rileva differenze tra il vecchio e il nuovo oggetto in scena.,iCub vuole leggere il libro.,,,M,I,,,,,0,29,29,21,,,,,21,24.323,871.2004652999894,None,,,30,001,2021_Nov_23_1647,InStance_GRUPPO_Psychopy,2020.1.3,59.597490470576645,
scenario34,scenario_34.jpg,iCub aggiorna le coordinate della posizione della palla.,iCub ha deciso di non lanciare la palla.,,,M,I,,,,,0,30,30,33,,,,,75,12.1,895.574603999994,None,,,30,001,2021_Nov_23_1647,InStance_GRUPPO_Psychopy,2020.1.3,59.597490470576645,
scenario13,scenario_13.jpg,iCub vuole disegnare qualcosa.,iCub ottimizza la presa sugli oggetti piccoli.,,,I,M,,,,,0,31,31,22,,,,,31,14.551,907.729342599996,None,,,30,001,2021_Nov_23_1647,InStance_GRUPPO_Psychopy,2020.1.3,59.597490470576645,
scenario1,scenario_1.jpg,iCub scansiona l'ambiente.,iCub è interessato a questi oggetti.,,,M,I,,,,,0,32,32,0,,,,,17,11.173,922.3269065999921,None,,,30,001,2021_Nov_23_1647,InStance_GRUPPO_Psychopy,2020.1.3,59.597490470576645,
scenario15,scenario_15.jpg,iCub rileva facimente gli oggetti con uno schermo.,iCub è incuriosito dalla tecnologia digitale.,,,M,I,,,,,0,33,33,7,,,,,34,28.006,933.5479835000006,None,,,30,001,2021_Nov_23_1647,InStance_GRUPPO_Psychopy,2020.1.3,59.597490470576645,
,,,,,,,,,,,,,,,,,,,,,,,,961.5754720999976,None,,,,,,,
