scenarioNo,ImageAll,TextLeft,TextRight,TypeLeft,TypeRight,Lefttype,Righttype,trials_Practice.thisRepN,trials_Practice.thisTrialN,trials_Practice.thisN,trials_Practice.thisIndex,trials_Pre.thisRepN,trials_Pre.thisTrialN,trials_Pre.thisN,trials_Pre.thisIndex,rating_p.response,rating_p.rt,textRight_p.started,textRight_p.stopped,rating.response,rating.rt,textLeft.started,textLeft.stopped,ThankYou.started,ThankYou.stopped,participant,session,date,expName,psychopyVersion,frameRate,
scenario2,scenario_0_EXAMPLE.png,iCub categorizza gli oggetti in base alla loro forma.,iCub preferisce gli oggetti sferici.,M,I,,,0,0,0,0,,,,,20,33.24,32.81523569999263,None,,,,,,,5,001,2021_Nov_08_1723,InStance_GRUPPO_Psychopy,2020.1.3,59.89935709916631,
scenario2,scenario_2.jpg,iCub è sorpreso di vedere l'oggetto in aria.,iCub guarda gli oggetti all'altezza degli occhi.,,,I,M,,,,,0,0,0,17,,,,,21,26.183,69.357648899997,None,,,5,001,2021_Nov_08_1723,InStance_GRUPPO_Psychopy,2020.1.3,59.89935709916631,
scenario29,scenario_29.jpg,iCub è bloccato.,iCub immagina che il giocattolo sia ancora lì.,,,M,I,,,,,0,1,1,14,,,,,82,24.252,95.6646880999906,None,,,5,001,2021_Nov_08_1723,InStance_GRUPPO_Psychopy,2020.1.3,59.89935709916631,
scenario27,scenario_27.jpg,iCub si diverte a giocare con il camioncino.,iCub allena la coordinazione testa-mano.,,,I,M,,,,,0,2,2,13,,,,,79,13.065,120.00737419999496,None,,,5,001,2021_Nov_08_1723,InStance_GRUPPO_Psychopy,2020.1.3,59.89935709916631,
scenario8,scenario_8.jpg,iCub finge di essere un giardiniere.,iCub regola la forza in base al peso dell'oggetto.,,,I,M,,,,,0,3,3,4,,,,,83,19.98,133.18973990000086,None,,,5,001,2021_Nov_08_1723,InStance_GRUPPO_Psychopy,2020.1.3,59.89935709916631,
scenario11,scenario_11.jpg,iCub calcola il peso delle palle.,iCub vuole giocare con la ragazza.,,,M,I,,,,,0,4,4,5,,,,,19,22.258,153.26174410000385,None,,,5,001,2021_Nov_08_1723,InStance_GRUPPO_Psychopy,2020.1.3,59.89935709916631,
scenario31,scenario_31.jpg,iCub mette gli oggetti nel contenitore con la forma corrispondente.,iCub sa che è giusto mettere in ordine il tavolo dopo aver giocato.,,,M,I,,,,,0,5,5,31,,,,,30,16.067,175.64076049999858,None,,,5,001,2021_Nov_08_1723,InStance_GRUPPO_Psychopy,2020.1.3,59.89935709916631,
scenario19,scenario_19.jpg,iCub non ha intenzione di raccogliere la lattina caduta.,iCub non può bloccare la procedura nonostante la lattina stia cadendo.,,,I,M,,,,,0,6,6,25,,,,,62,23.875,191.83323180000298,None,,,5,001,2021_Nov_08_1723,InStance_GRUPPO_Psychopy,2020.1.3,59.89935709916631,
scenario14,scenario_14.jpg,iCub registra le città italiane in ordine alfabetico.,iCub preferisce le città italiane.,,,M,I,,,,,0,7,7,23,,,,,19,14.826,215.83390519999375,None,,,5,001,2021_Nov_08_1723,InStance_GRUPPO_Psychopy,2020.1.3,59.89935709916631,
scenario26,scenario_26.jpg,iCub è deluso che la palla non rimbalzi.,iCub ha un malfunzionamento alla mano.,,,I,M,,,,,0,8,8,12,,,,,18,10.901,230.77490049999324,None,,,5,001,2021_Nov_08_1723,InStance_GRUPPO_Psychopy,2020.1.3,59.89935709916631,
scenario16,scenario_16.jpg,iCub ha deciso di cucinare una torta.,iCub segue le istruzioni della ricetta.,,,I,M,,,,,0,9,9,8,,,,,81,32.615,241.7899602999969,None,,,5,001,2021_Nov_08_1723,InStance_GRUPPO_Psychopy,2020.1.3,59.89935709916631,
scenario30,scenario_30.jpg,iCub non riesce a scegliere con quale giocattolo giocare.,iCub è in modalità stand-by.,,,I,M,,,,,0,10,10,15,,,,,80,17.799,274.5129234999913,None,,,5,001,2021_Nov_08_1723,InStance_GRUPPO_Psychopy,2020.1.3,59.89935709916631,
scenario4,scenario_4.jpg,iCub calcola il numero di monete.,iCub ha deciso di restituire le monete.,,,M,I,,,,,0,11,11,18,,,,,23,11.873,292.4333149000013,None,,,5,001,2021_Nov_08_1723,InStance_GRUPPO_Psychopy,2020.1.3,59.89935709916631,
scenario6,scenario_6.jpg,iCub traccia il cursore del mouse.,iCub è interessato a quello che c'è sullo schermo.,,,M,I,,,,,0,12,12,19,,,,,33,14.815,304.4198471999989,None,,,5,001,2021_Nov_08_1723,InStance_GRUPPO_Psychopy,2020.1.3,59.89935709916631,
scenario22,scenario_22.jpg,iCub riporta la testa nella posizione iniziale.,iCub non è più interessato al giocattolo.,,,M,I,,,,,0,13,13,27,,,,,72,15.56,319.35375059999933,None,,,5,001,2021_Nov_08_1723,InStance_GRUPPO_Psychopy,2020.1.3,59.89935709916631,
scenario28,scenario_28.jpg,iCub vorrebbe tenere questo cubo.,iCub classifica i cubi in base al colore.,,,I,M,,,,,0,14,14,30,,,,,85,17.988,335.0356624999986,None,,,5,001,2021_Nov_08_1723,InStance_GRUPPO_Psychopy,2020.1.3,59.89935709916631,
scenario3,scenario_3.jpg,iCub afferra meglio gli oggetti cilindrici.,iCub pensa che alla ragazza piaccia il bicchiere.,,,M,I,,,,,0,15,15,1,,,,,67,18.313,353.141380999994,None,,,5,001,2021_Nov_08_1723,InStance_GRUPPO_Psychopy,2020.1.3,59.89935709916631,
scenario20,scenario_20.jpg,iCub muove la testa verso I maglioni dai colori luminosi.,iCub è sorpreso che ci sia una persona nuova.,,,M,I,,,,,0,16,16,26,,,,,73,15.701,371.5745637999935,None,,,5,001,2021_Nov_08_1723,InStance_GRUPPO_Psychopy,2020.1.3,59.89935709916631,
scenario17,scenario_17.jpg,iCub cerca di essere affascinante.,iCub ha i motori delle palpebre rotti.,,,I,M,,,,,0,17,17,24,,,,,22,9.401,387.39386640000157,None,,,5,001,2021_Nov_08_1723,InStance_GRUPPO_Psychopy,2020.1.3,59.89935709916631,
scenario21,scenario_21.jpg,iCub pensa che le ragazze abbiano bisogno di cibo sano.,iCub può afferrare le arance più facilmente della torta.,,,I,M,,,,,0,18,18,10,,,,,39,18.166,396.91934569999285,None,,,5,001,2021_Nov_08_1723,InStance_GRUPPO_Psychopy,2020.1.3,59.89935709916631,
scenario13,scenario_13.jpg,iCub vuole disegnare qualcosa.,iCub ottimizza la presa sugli oggetti piccoli.,,,I,M,,,,,0,19,19,22,,,,,69,22.591,415.2137393000012,None,,,5,001,2021_Nov_08_1723,InStance_GRUPPO_Psychopy,2020.1.3,59.89935709916631,
scenario12,scenario_12.jpg,iCub allinea la testa con la webcam.,iCub è sorpreso dalla webcam che si muove.,,,M,I,,,,,0,20,20,6,,,,,24,8.983,437.9398166000028,None,,,5,001,2021_Nov_08_1723,InStance_GRUPPO_Psychopy,2020.1.3,59.89935709916631,
scenario23,scenario_23.jpg,iCub sta esprimendo un'opinione.,iCub sta ripetendo il gesto di indicare.,,,I,M,,,,,0,21,21,28,,,,,63,17.98,447.03891339999973,None,,,5,001,2021_Nov_08_1723,InStance_GRUPPO_Psychopy,2020.1.3,59.89935709916631,
scenario10,scenario_10.jpg,iCub rileva differenze tra il vecchio e il nuovo oggetto in scena.,iCub vuole leggere il libro.,,,M,I,,,,,0,22,22,21,,,,,32,15.479,465.15101180000056,None,,,5,001,2021_Nov_08_1723,InStance_GRUPPO_Psychopy,2020.1.3,59.89935709916631,
scenario7,scenario_7.jpg,iCub traccia la posizione della palla.,iCub non vede l'ora di ricevere la palla.,,,M,I,,,,,0,23,23,3,,,,,25,9.566,480.75086349999765,None,,,5,001,2021_Nov_08_1723,InStance_GRUPPO_Psychopy,2020.1.3,59.89935709916631,
scenario34,scenario_34.jpg,iCub aggiorna le coordinate della posizione della palla.,iCub ha deciso di non lanciare la palla.,,,M,I,,,,,0,24,24,33,,,,,31,13.052,490.4358776000008,None,,,5,001,2021_Nov_08_1723,InStance_GRUPPO_Psychopy,2020.1.3,59.89935709916631,
scenario18,scenario_18.jpg,iCub misura la distanza fra la ragazza e le cuffie.,iCub si aspetta che la ragazza dia in prestito le cuffie.,,,M,I,,,,,0,25,25,9,,,,,60,21.666,503.6041836999939,None,,,5,001,2021_Nov_08_1723,InStance_GRUPPO_Psychopy,2020.1.3,59.89935709916631,
scenario5,scenario_5.jpg,iCub è annoiato.,iCub è in fase di spegnimento.,,,I,M,,,,,0,26,26,2,,,,,69,7.634,525.3835778999928,None,,,5,001,2021_Nov_08_1723,InStance_GRUPPO_Psychopy,2020.1.3,59.89935709916631,
scenario15,scenario_15.jpg,iCub rileva facimente gli oggetti con uno schermo.,iCub è incuriosito dalla tecnologia digitale.,,,M,I,,,,,0,27,27,7,,,,,75,18.259,533.145900699994,None,,,5,001,2021_Nov_08_1723,InStance_GRUPPO_Psychopy,2020.1.3,59.89935709916631,
scenario24,scenario_24.jpg,iCub traccia i movimenti della mano.,iCub ha capito che la ragazza vuole la palla.,,,M,I,,,,,0,28,28,11,,,,,75,7.665,551.5286266999901,None,,,5,001,2021_Nov_08_1723,InStance_GRUPPO_Psychopy,2020.1.3,59.89935709916631,
scenario25,scenario_25.jpg,iCub bara guardando le carte dell'avversario.,iCub ha perso l'equilibrio per un momento.,,,I,M,,,,,0,29,29,29,,,,,29,13.852,559.3152488999913,None,,,5,001,2021_Nov_08_1723,InStance_GRUPPO_Psychopy,2020.1.3,59.89935709916631,
scenario32,scenario_32.jpg,iCub si diverte contando le dita su ciascuna mano.,iCub calibra la posizione della testa con quella della mano.,,,I,M,,,,,0,30,30,16,,,,,32,10.276,573.2914196999918,None,,,5,001,2021_Nov_08_1723,InStance_GRUPPO_Psychopy,2020.1.3,59.89935709916631,
scenario1,scenario_1.jpg,iCub scansiona l'ambiente.,iCub è interessato a questi oggetti.,,,M,I,,,,,0,31,31,0,,,,,74,10.975,583.6791201000015,None,,,5,001,2021_Nov_08_1723,InStance_GRUPPO_Psychopy,2020.1.3,59.89935709916631,
scenario9,scenario_9.jpg,iCub è disperato perchè non trova il suo giocattolo preferito.,iCub ha i motori rotti.,,,I,M,,,,,0,32,32,20,,,,,20,13.287,594.76588549999,None,,,5,001,2021_Nov_08_1723,InStance_GRUPPO_Psychopy,2020.1.3,59.89935709916631,
scenario33,scenario_33.jpg,iCub è affascinato dall'uso degli utensili.,iCub afferra l'oggetto più vicino.,,,I,M,,,,,0,33,33,32,,,,,29,10.201,608.1744045999949,None,,,5,001,2021_Nov_08_1723,InStance_GRUPPO_Psychopy,2020.1.3,59.89935709916631,
,,,,,,,,,,,,,,,,,,,,,,,,618.3983814999956,None,,,,,,,
